{
  "claim_id": "R3K08-C1",
  "atomicity": "ATOMIC",
  "content_origin": {
    "assignment_status": "ASSIGNED",
    "kind": "MAPPING_GENERATED",
    "origin_refs": [],
    "competing_origins": [],
    "rationale": "The target supplies the workload ceiling but leaves the response unspecified. The source supplies general stopping-rule guidance. The mapping authors the specific conditional stop instruction."
  },
  "epistemic_function": {
    "assignment_status": "ASSIGNED",
    "kind": "GOVERNANCE_RULE",
    "competing_functions": [],
    "rationale": "The claim prescribes a prospective control action: stop the trial if the agreed workload threshold is exceeded."
  }
}
