{
  "claim_id": "R3K12-C1",
  "atomicity": "ATOMIC",
  "content_origin": {
    "assignment_status": "ASSIGNED",
    "kind": "MAPPING_GENERATED",
    "origin_refs": [],
    "competing_origins": [],
    "rationale": "Neither input supplies the rule to apply a corrective procedure if the pattern continues."
  },
  "epistemic_function": {
    "assignment_status": "ASSIGNED",
    "kind": "GOVERNANCE_RULE",
    "competing_functions": [],
    "rationale": "The claim prescribes a prospective if-X-do-Y rule. The unresolved intervention referent is subordinate to that rule and does not create another primary assertion or function."
  }
}