{
  "claim_id": "K09-C1",
  "atomicity": "ATOMIC",
  "content_origin": {
    "assignment_status": "ASSIGNED",
    "kind": "MAPPING_GENERATED",
    "origin_refs": [],
    "competing_origins": [],
    "rationale": "The target supplies observed counts and the source supplies a general interpretive relation. The mapping introduces the sharply increased incidence conclusion by combining them; neither input explicitly supplies that conclusion at the claim's scope."
  },
  "epistemic_function": {
    "assignment_status": "ASSIGNED",
    "kind": "INFERENCE",
    "competing_functions": [],
    "rationale": "The mapping explicitly frames C1 as interpreting the controlled observations to establish an error-incidence conclusion. It asserts that conclusion, rather than describing what a hypothetical outcome would imply."
  }
}