{
  "claim_id": "R3K10-C1",
  "atomicity": "ATOMIC",
  "content_origin": {
    "assignment_status": "ASSIGNED",
    "kind": "MAPPING_GENERATED",
    "origin_refs": [],
    "competing_origins": [],
    "rationale": "Neither input supplies the policy of repeating X forever regardless of results; that policy is introduced by the mapping."
  },
  "epistemic_function": {
    "assignment_status": "ASSIGNED",
    "kind": "GOVERNANCE_RULE",
    "competing_functions": [],
    "rationale": "The claim prescribes one prospective scheduling policy: execute X indefinitely without terminating the decision process. Performing X is subordinate to that policy."
  }
}